{
  "schema_version": 1,
  "id": "telegram",
  "display_name": "Treer Telegram",
  "version": "0.1.0",
  "minimum_treer_version": "0.1.2",
  "entrypoint": {
    "argv": ["python3", "telegram.py"],
    "operating_systems": ["linux", "macos"]
  },
  "capabilities": [
    "message.send",
    "message.receive",
    "message.ack",
    "agent.metadata.read",
    "agent.prompt"
  ],
  "configuration": [],
  "secrets": ["TELEGRAM_BOT_TOKEN"],
  "state_version": 1,
  "checksums": {}
}
