{
  "schema_version": 1,
  "id": "contract-fixture",
  "display_name": "Treer Plugin Contract Fixture",
  "version": "0.1.0",
  "minimum_treer_version": "0.1.2",
  "entrypoint": {
    "argv": ["python3", "fixture.py"],
    "operating_systems": ["linux", "macos"]
  },
  "capabilities": ["message.receive"],
  "configuration": ["FIXTURE_CHANNEL"],
  "secrets": ["FIXTURE_SECRET"],
  "state_version": 1,
  "checksums": {}
}
